CREATE GRAPH cypher_dml2;
CREATE VLABEL v1;
EXPLAIN ( analyze false, verbose true, costs false, buffers false, timing false )
MATCH (p:v1)
return max(collect(p.name)) as col;
ERROR:  aggregate function calls cannot be nested
LINE 3: return max(collect(p.name)) as col;
                   ^
MATCH (p:v1)
return max(collect(p.name)) as col;
ERROR:  aggregate function calls cannot be nested
LINE 2: return max(collect(p.name)) as col;
                   ^
MATCH (p:v1)
with collect(p.name) as col
RETURN max(col);
 max 
-----
 
(1 row)

CREATE ELABEL e1;
-- AGV2-29, Predicates functions want jsonb, not list
MATCH p=(n1)-[r:e1*2]->(n2)
WHERE all(x in r where x.id is null)
RETURN count(p);
 count 
-------
 0
(1 row)

-- AGV2-26, head/tail/last returns array
CREATE(:v_user{name:'userA'});
CREATE(:v_title{name:'TitleA'});
CREATE(:v_type{name:'TypeA'});
CREATE(:v_sub{name:'SubA'});
MATCH(v1:v_user{name:'userA'}), (v2:v_title{name:'TitleA'})
CREATE (v1)-[:e_user_title{name:'(1)', val:1}]->(v2);
MATCH(v1:v_title{name:'TitleA'}), (v2:v_type{name:'TypeA'})
CREATE (v1)-[:e_title_type{name:'(2)', val:2}]->(v2);
MATCH(v1:v_type{name:'TypeA'}), (v2:v_sub{name:'SubA'})
CREATE (v1)-[:e_title_type{name:'(3)', val:3}]->(v2);
MATCH(n)-[e*3]->(n3) RETURN e;
                                                                                e                                                                                
-----------------------------------------------------------------------------------------------------------------------------------------------------------------
 [e_user_title[9.1][5.1,6.1]{"val": 1, "name": "(1)"},e_title_type[10.1][6.1,7.1]{"val": 2, "name": "(2)"},e_title_type[10.2][7.1,8.1]{"val": 3, "name": "(3)"}]
(1 row)

MATCH(n)-[e*3]->(n3) RETURN head(e);
                        head                         
-----------------------------------------------------
 e_user_title[9.1][5.1,6.1]{"val": 1, "name": "(1)"}
(1 row)

MATCH(n)-[e*3]->(n3) RETURN tail(e);
                                                    tail                                                     
-------------------------------------------------------------------------------------------------------------
 [e_title_type[10.1][6.1,7.1]{"val": 2, "name": "(2)"},e_title_type[10.2][7.1,8.1]{"val": 3, "name": "(3)"}]
(1 row)

MATCH(n)-[e*3]->(n3) RETURN last(e);
                         last                         
------------------------------------------------------
 e_title_type[10.2][7.1,8.1]{"val": 3, "name": "(3)"}
(1 row)

-- Trigger
CREATE TEMPORARY TABLE _trigger_history(
    id graphid,
    is_before boolean,
    CONSTRAINT pk_history PRIMARY KEY (id, is_before)
);
CREATE OR REPLACE FUNCTION v1_test_trigger_func_be()
returns trigger
AS $$
DECLARE
BEGIN
    raise notice 'Bf: % %', new, old;
    CASE WHEN new.id IS NULL
    THEN
        DELETE FROM _trigger_history WHERE _trigger_history.id = old.id AND
            _trigger_history.is_before = true;
        RETURN old;
    ELSE
        INSERT INTO _trigger_history(id, is_before) VALUES (new.id, true);
        RETURN new;
    END CASE;
END; $$
LANGUAGE 'plpgsql';
create trigger v1_test_trigger_be
    before insert or delete or update on cypher_dml2.v1
	for each row
    execute procedure v1_test_trigger_func_be();
CREATE OR REPLACE FUNCTION v1_test_trigger_func_af()
returns trigger
AS $$
DECLARE
BEGIN
    raise notice 'Af: % %', new, old;
    CASE WHEN new.id IS NULL THEN
        DELETE FROM _trigger_history WHERE _trigger_history.id = old.id AND
            _trigger_history.is_before = false;
        RETURN old;
    ELSE
        INSERT INTO _trigger_history(id, is_before) VALUES (new.id, false);
        RETURN new;
    END CASE;
END; $$
LANGUAGE 'plpgsql';
create trigger v1_test_trigger_af
    after insert or delete or update on cypher_dml2.v1
	for each row
    execute procedure v1_test_trigger_func_af();
CREATE (v1:v1 {name: 'trigger_item'}) RETURN v1;
NOTICE:  Bf: (3.1,"{""name"": ""trigger_item""}") <NULL>
NOTICE:  Af: (3.1,"{""name"": ""trigger_item""}") <NULL>
               v1                
---------------------------------
 v1[3.1]{"name": "trigger_item"}
(1 row)

SELECT * FROM _trigger_history;
 id  | is_before 
-----+-----------
 3.1 | t
 3.1 | f
(2 rows)

-- Must fail
MATCH (n) SET n.name = 'trigger_item_updated' RETURN n;
NOTICE:  Bf: (3.1,"{""name"": ""trigger_item_updated""}") (3.1,"{""name"": ""trigger_item""}")
ERROR:  duplicate key value violates unique constraint "pk_history"
DETAIL:  Key (id, is_before)=(3.1, t) already exists.
CONTEXT:  SQL statement "INSERT INTO _trigger_history(id, is_before) VALUES (new.id, true)"
PL/pgSQL function v1_test_trigger_func_be() line 11 at SQL statement
SELECT * FROM _trigger_history;
 id  | is_before 
-----+-----------
 3.1 | t
 3.1 | f
(2 rows)

-- Should pass
DELETE FROM _trigger_history;
MATCH (n) SET n.name = 'trigger_item_updated' RETURN n;
NOTICE:  Bf: (3.1,"{""name"": ""trigger_item_updated""}") (3.1,"{""name"": ""trigger_item""}")
NOTICE:  Af: (3.1,"{""name"": ""trigger_item_updated""}") (3.1,"{""name"": ""trigger_item""}")
                      n                       
----------------------------------------------
 v1[3.1]{"name": "trigger_item_updated"}
 v_user[5.1]{"name": "trigger_item_updated"}
 v_title[6.1]{"name": "trigger_item_updated"}
 v_type[7.1]{"name": "trigger_item_updated"}
 v_sub[8.1]{"name": "trigger_item_updated"}
(5 rows)

SELECT * FROM _trigger_history;
 id  | is_before 
-----+-----------
 3.1 | t
 3.1 | f
(2 rows)

-- Must empty
MATCH (n) DETACH DELETE n;
NOTICE:  Bf: <NULL> (3.1,"{""name"": ""trigger_item_updated""}")
NOTICE:  Af: <NULL> (3.1,"{""name"": ""trigger_item_updated""}")
SELECT * FROM _trigger_history;
 id | is_before 
----+-----------
(0 rows)

DROP GRAPH cypher_dml2 CASCADE;
NOTICE:  drop cascades to 11 other objects
DETAIL:  drop cascades to sequence cypher_dml2.ag_label_seq
drop cascades to vlabel ag_vertex
drop cascades to elabel ag_edge
drop cascades to vlabel v1
drop cascades to elabel e1
drop cascades to vlabel v_user
drop cascades to vlabel v_title
drop cascades to vlabel v_type
drop cascades to vlabel v_sub
drop cascades to elabel e_user_title
drop cascades to elabel e_title_type
