--
-- SQL Restriction with Graph objects
--
-- prepare
CREATE GRAPH g;
CREATE ROLE tmp;
--
-- ALTER SCHEMA
--
ALTER SCHEMA g RENAME TO s;
ERROR:  cannot rename schema "g"
HINT:  Use RENAME GRAPH instead
ALTER SCHEMA g OWNER TO tmp;
ERROR:  cannot alter schema "g"
HINT:  Use ALTER GRAPH instead
--
-- CREATE TABLE
--
CREATE TABLE g.t (i int);
ERROR:  cannot create table in graph schema
CREATE TABLE t (i int) INHERITS (g.ag_vertex);
ERROR:  invalid parent, table cannot inherit label
--
-- ALTER TABLE
--
GRANT ALL ON DATABASE regression TO tmp;
SET ROLE tmp;
CREATE GRAPH t;
SET graph_path = t;
CREATE VLABEL v;
ALTER TABLE t.v ADD COLUMN tmp int;
ERROR:  cannot add a column to graph label "v" with ALTER TABLE
HINT:  Use ALTER VLABEL or ALTER ELABEL instead, which keeps the graph catalog in step.
-- Adding a constraint does not reshape a label, so the label's owner may add one
-- without being a superuser.  That is not a concession: it is how a dump restores
-- a label's primary key, and how CREATE CONSTRAINT ... ASSERT is carried out, so
-- refusing it made a graph restorable only by a superuser.
ALTER TABLE t.v ADD CONSTRAINT tmp_chk CHECK (true);
-- and tuning a label is likewise the owner's to do
ALTER TABLE t.v ALTER COLUMN properties SET STATISTICS 100;
-- What the owner may not do is reshape it, which is what the gate is for.
ALTER TABLE t.v ADD COLUMN reshaped int;
ERROR:  cannot add a column to graph label "v" with ALTER TABLE
HINT:  Use ALTER VLABEL or ALTER ELABEL instead, which keeps the graph catalog in step.
ALTER TABLE t.v DROP COLUMN properties;
ERROR:  cannot drop a column of graph label "v" with ALTER TABLE
HINT:  Use ALTER VLABEL or ALTER ELABEL instead, which keeps the graph catalog in step.
RESET ROLE;
SET graph_path = g;
CREATE VLABEL v;
ALTER TABLE g.v RENAME TO e;
ERROR:  cannot rename table "v"
HINT:  Use rename label instead
--
-- TRUNCATE TABLE
--
-- A label holding rows cannot be truncated: TRUNCATE would bypass the Cypher
-- graph-consistency machinery (orphaning incident edges, staling ag_graphmeta).
CREATE (:v);
TRUNCATE TABLE g.v;
ERROR:  cannot truncate label in graph schema
-- Truncating an empty label is a no-op and is allowed, so a freshly created
-- label can be reloaded by a parallel pg_restore.
CREATE VLABEL vacant;
TRUNCATE TABLE g.vacant;
--
-- TRIGGER
--
CREATE TRIGGER tt AFTER INSERT ON g.v
FOR EACH STATEMENT EXECUTE PROCEDURE ff();
ERROR:  function ff() does not exist
--
-- RULE
--
CREATE VLABEL v2;
CREATE RULE rr AS ON INSERT TO g.v DO INSTEAD
	INSERT INTO g.v2 VALUES (new.id, new.properties);
ERROR:  cannot create rule on graph label
--
-- DML
--
INSERT INTO g.v VALUES ('1234.56', NULL);
ERROR:  DML query to graph objects is not allowed
UPDATE g.v SET properties='{"update":"impossible"}' WHERE id = '1234.56';
ERROR:  DML query to graph objects is not allowed
DELETE FROM g.v;
ERROR:  DML query to graph objects is not allowed
-- MERGE writes a label the same way the three above do
CREATE TABLE mergesrc (k int);
MERGE INTO g.v AS t USING mergesrc AS s ON (t.properties ->> 'k')::int = s.k
	WHEN MATCHED THEN UPDATE SET properties = '{"merge":"impossible"}'
	WHEN NOT MATCHED THEN INSERT (properties) VALUES ('{"merge":"impossible"}');
ERROR:  DML query to graph objects is not allowed
-- The refusal does not depend on which actions the MERGE carries, because any of
-- them can write: an insert-only one, an update-only one, a delete-only one, and
-- one whose only action is to do nothing are all refused, so nothing has to be
-- known about what the statement would have done.
INSERT INTO mergesrc VALUES (1);
MERGE INTO g.v AS t USING mergesrc AS s ON (t.properties ->> 'k')::int = s.k
	WHEN NOT MATCHED THEN INSERT (properties) VALUES ('{"merge":"impossible"}');
ERROR:  DML query to graph objects is not allowed
MERGE INTO g.v AS t USING mergesrc AS s ON (t.properties ->> 'k')::int = s.k
	WHEN MATCHED THEN UPDATE SET properties = '{"merge":"impossible"}';
ERROR:  DML query to graph objects is not allowed
MERGE INTO g.v AS t USING mergesrc AS s ON (t.properties ->> 'k')::int = s.k
	WHEN MATCHED THEN DELETE;
ERROR:  DML query to graph objects is not allowed
MERGE INTO g.v AS t USING mergesrc AS s ON (t.properties ->> 'k')::int = s.k
	WHEN NOT MATCHED THEN DO NOTHING;
ERROR:  DML query to graph objects is not allowed
-- nothing was written by any of them
SELECT count(*) AS label_rows FROM g.v;
 label_rows 
------------
          1
(1 row)

-- A label as the SOURCE of a MERGE is only read, so it is not refused: the target
-- is what decides, exactly as it does for INSERT ... SELECT.
CREATE TABLE mergetgt (k int);
MERGE INTO mergetgt AS t USING g.v AS s ON t.k = 1
	WHEN NOT MATCHED THEN INSERT (k) VALUES (1);
SELECT count(*) AS target_rows FROM mergetgt;
 target_rows 
-------------
           1
(1 row)

DROP TABLE mergetgt;
-- And it is the same permission the other three ask for: with it granted the
-- MERGE goes through, and the label really is written.
SET enable_graph_dml = on;
MERGE INTO g.v AS t USING mergesrc AS s ON (t.properties ->> 'k')::int = s.k
	WHEN NOT MATCHED THEN INSERT (properties) VALUES ('{"merge":"allowed"}');
RESET enable_graph_dml;
SELECT count(*) AS written FROM g.v WHERE properties ? 'merge';
 written 
---------
       1
(1 row)

MERGE INTO g.v AS t USING mergesrc AS s ON (t.properties ->> 'k')::int = s.k
	WHEN MATCHED THEN UPDATE SET properties = '{"merge":"impossible"}';
ERROR:  DML query to graph objects is not allowed
SELECT properties FROM g.v WHERE properties ? 'merge';
      properties      
----------------------
 {"merge": "allowed"}
(1 row)

DROP TABLE mergesrc;
-- cleanup
REVOKE ALL ON DATABASE regression FROM tmp;
DROP GRAPH t CASCADE;
NOTICE:  drop cascades to 4 other objects
DETAIL:  drop cascades to sequence t.ag_label_seq
drop cascades to vlabel ag_vertex
drop cascades to elabel ag_edge
drop cascades to vlabel v
DROP ROLE tmp;
DROP GRAPH g CASCADE;
NOTICE:  drop cascades to 6 other objects
DETAIL:  drop cascades to sequence g.ag_label_seq
drop cascades to vlabel ag_vertex
drop cascades to elabel ag_edge
drop cascades to vlabel v
drop cascades to vlabel vacant
drop cascades to vlabel v2
